{
  "$schema": "http://json-schema.org/draft-07/schema#",
  "title": "Gm2 Blueprint",
  "type": "object",
  "properties": {
    "post_types": {
      "type": "object",
      "additionalProperties": { "$ref": "#/definitions/postType" }
    },
    "taxonomies": {
      "type": "object",
      "additionalProperties": { "$ref": "#/definitions/taxonomy" }
    },
    "field_groups": {
      "type": "array",
      "items": { "$ref": "#/definitions/fieldGroup" }
    },
    "schema_mappings": {
      "type": "object",
      "additionalProperties": { "$ref": "#/definitions/schemaMapping" }
    }
  },
  "additionalProperties": false,
  "definitions": {
    "postType": {
      "type": "object",
      "properties": {
        "label": { "type": "string" },
        "public": { "type": "boolean" },
        "supports": {
          "type": "array",
          "items": { "type": "string" }
        },
        "labels": { "type": "object", "additionalProperties": { "type": "string" } },
        "has_archive": { "type": ["boolean", "string"] },
        "rewrite": {
          "type": "object",
          "properties": { "slug": { "type": "string" } },
          "additionalProperties": { "type": ["string", "boolean"] }
        },
        "menu_icon": { "type": "string" }
      },
      "additionalProperties": true
    },
    "taxonomy": {
      "type": "object",
      "properties": {
        "object_type": {
          "type": "array",
          "items": { "type": "string" }
        },
        "labels": { "type": "object", "additionalProperties": { "type": "string" } },
        "hierarchical": { "type": "boolean" },
        "rewrite": {
          "type": "object",
          "properties": { "slug": { "type": "string" } },
          "additionalProperties": { "type": ["string", "boolean"] }
        }
      },
      "additionalProperties": true
    },
    "fieldGroup": {
      "type": "object",
      "properties": {
        "key": { "type": "string" },
        "title": { "type": "string" },
        "fields": {
          "type": "array",
          "items": { "$ref": "#/definitions/field" }
        }
      },
      "required": ["key", "title", "fields"],
      "additionalProperties": true
    },
      "field": {
      "type": "object",
      "properties": {
        "key": { "type": "string" },
        "label": { "type": "string" },
        "name": { "type": "string" },
        "type": { "type": "string" },
        "required": { "type": "boolean" },
        "regex": { "type": "string" },
        "min": { "type": ["number", "integer"] },
        "max": { "type": ["number", "integer"] },
        "expose_in_rest": { "type": "boolean" }
      },
      "required": ["key", "label", "name", "type"],
      "additionalProperties": true
    },
    "schemaMapping": {
      "type": "object",
      "properties": {
        "type": { "type": "string" },
        "map": {
          "type": "object",
          "additionalProperties": { "type": "string" }
        }
      },
      "required": ["type", "map"],
      "additionalProperties": false
    }
  }
}
