{
  "post_types": {
    "course": {
      "labels": { "name": "Courses", "singular_name": "Course" },
      "supports": ["title", "editor", "thumbnail"],
      "has_archive": true,
      "rewrite": { "slug": "courses" },
      "menu_icon": "dashicons-welcome-learn-more"
    }
  },
  "taxonomies": {
    "course_category": {
      "object_type": ["course"],
      "labels": { "name": "Course Categories", "singular_name": "Course Category" },
      "hierarchical": false,
      "rewrite": { "slug": "course-category" }
    }
  },
  "field_groups": [
    {
      "key": "group_course_details",
      "title": "Course Details",
      "fields": [
        {
          "key": "field_provider",
          "label": "Provider",
          "name": "provider",
          "type": "text",
          "required": true,
          "expose_in_rest": true
        },
        {
          "key": "field_course_code",
          "label": "Course Code",
          "name": "course_code",
          "type": "text",
          "regex": "^[A-Z0-9-]+$",
          "required": true,
          "expose_in_rest": true
        },
        {
          "key": "field_course_url",
          "label": "Course URL",
          "name": "course_url",
          "type": "url",
          "expose_in_rest": true
        }
      ]
    }
  ],
  "schema_mappings": {
    "course": {
      "type": "Course",
      "map": {
        "provider": "provider",
        "courseCode": "course_code",
        "url": "course_url"
      }
    }
  }
}
