{
  "post_types": {
    "job": {
      "label": "Job",
      "public": true,
      "supports": ["title", "editor"]
    }
  },
  "taxonomies": {
    "job_category": {
      "object_type": ["job"],
      "label": "Job Categories",
      "hierarchical": false
    }
  },
  "field_groups": [
    {
      "key": "group_job_details",
      "title": "Job Details",
      "fields": [
        {"key": "field_date_posted", "label": "Date Posted", "name": "date_posted", "type": "date"},
        {"key": "field_employment_type", "label": "Employment Type", "name": "employment_type", "type": "text"},
        {"key": "field_company", "label": "Company", "name": "company", "type": "text"}
      ]
    }
  ],
  "schema_mappings": {
    "job": {
      "type": "JobPosting",
      "map": {
        "datePosted": "date_posted",
        "employmentType": "employment_type",
        "hiringOrganization": "company"
      }
    }
  }
}
